{
  "backendOrder": ["codex-cli/local-worktree"],
  "maxParallel": 2,
  "workItemTimeoutMinutes": 30,
  "objectiveTimeoutMinutes": 720,
  "maxAttemptsPerItem": 3,
  "allowedPaidBackends": [],
  "cloudFallback": "never",
  "maxSandboxMinutes": 0,
  "maxManagedAgentSessions": 0,
  "trust": "explicitly_activated_repo",
  "managementBackend": "codex-cli/local",
  "allowedNetworkDestinations": ["registry.npmjs.org", "*.npmjs.org", "api.openai.com"]
}
